objectid,title,creator,date,description,subject,location,latitude,longitude,source,identifier,type,format,language,rights,rightsstatement,display_template,object_location,image_small,image_thumb,image_alt_text,object_transcript,address,cataloger,citation,filename,structure
bag_01_southernoregon_1850,Beaded Pouch,Southern Oregon Coast Artist,1850,"A beaded pouch created by an unknown artist in the Southern Oregon Coast. The beadwork on the pouch is made of many different colors and depicts two flowers visited by a butterfly and another nondescript insect, all surrounded by a heart.",Beadwork (visual works),Oregon (state),,,Portland Art Museum,2005.73.20,Image;StillImage,image/jpeg,,No known copyright restrictions ,https://rightsstatements.org/page/NKC/1.0/?language=en,image,,,,"A beaded pouch made of many different colors. The pouch depicts two flowers visited by a butterfly and another nondescript insect, all surrounded by a heart.",,http://www.portlandartmuseum.us/mwebcgi/mweb.exe?request=record;id=33092;type=101#,Hunter,"Southern Oregon Coast artist. Beaded Pouch. ca. 1850, Portland Art Museum, Portland, Oregon, http://www.portlandartmuseum.us/mwebcgi/mweb.exe?request=record;id=33092;type=101#",bag_01_southernoregon_1850.jpg,Bag
bag_02_oregon_1920,Corn Husk Bag,Unknown,1920,"A woven Cornhusk bag made by an unknown Native American artist from Oregon. The bag depicts repeating green conifer trees on one side, and a geometric square design in green, orange, blue, red, pink, and purple on the other.",Bags (generic containers),Oregon (state),,,Hallie Ford Museum of Art,2017.026.040,Image;StillImage,image/jpeg,,No known copyright restrictions ,https://rightsstatements.org/page/CNE/1.0/?language=en,image,,,,"A woven Cornhusk bag that depicts repeating green conifer trees on one side, and a geometric square design in green, orange, blue, red, pink, and purple on the other.",,https://willametteart.pastperfectonline.com/webobject/1618F43E-0758-40BB-9500-121802155937,Anna,"Unknown. Corn Husk Bag. ca. 1920s, Hallie Ford Museum of Art, Salem, Oregon, https://willametteart.pastperfectonline.com/webobject/1618F43E-0758-40BB-9500-121802155937",bag_02_oregon_1920.jpg,Bag
bag_03_oregonwashington_1860,Beaded Bag,Wasco Artist,1860,A beaded bag created by an unknown Wasco artist. The bag depicts alternating human and horse figures on the top half and geometric designs on the bottom half.,Beadwork (visual works),Oregon (state); Washington (state),,,The Metropolitan Museum of Art,2021.434.22,Image;StillImage,image/jpeg,,Public Domain,https://creativecommons.org/publicdomain/zero/1.0/,image,,,,"A beaded bag that depicts alternating human and horse figures on the top half made of pink, blue, green, yellow, and black beads. Geometric designs are on the bottom half in red, black, and green beads.",,https://www.metmuseum.org/art/collection/search/717543,Anna,"Wasco artist. Beaded Bag. ca. 1860, The Metropolitan Museum of Art, New York City, New York, https://www.metmuseum.org/art/collection/search/717543",bag_03_oregonwashington_1860.jpg,Bag
basket_01_westernoregon_1900,Handled Gathering Basket,Umqua Artist,1900,"A woven basket presumably used to gather goods created by an unknown artist of the Umpqua people. The basket is made of hazel shoots and spruce roots, and the two materials appear as different colors. The basket features no distinctive patterns or representations.",Baskets (containers),Oregon (state),,,Portland Art Museum,2012.97.8,Image;StillImage,image/jpeg,,No known copyright restrictions,https://rightsstatements.org/page/NKC/1.0/?language=en,image,,,,A woven basket with a handle made of hazel shoots and spruce roots. The two materials appear as different shades of brown. The basket features no distinctive patterns or representations.,,http://www.portlandartmuseum.us/mwebcgi/mweb.exe?request=record;id=33889;type=101,Hunter,"Umpqua artist. Handled Gathering Basket. ca. 1900, Portland Art Museum, Portland, Oregon, http://www.portlandartmuseum.us/mwebcgi/mweb.exe?request=record;id=33889;type=101",basket_01_westernoregon_1900.jpg,Basket
basket_02_westernoregon_1890,Basket,Calapooia Artist,1890,"A woven basket created by an unknown artist of the Calapooia (Kalapuya) people. The basket is made of juncus rush and dyed raffia, creating two colors in the basket.",Baskets (containers),Oregon (state); Washington (state),,,Portland Art Museum,2012.25.40,Image;StillImage,image/jpeg,,No known copyright restrictions,https://rightsstatements.org/page/NKC/1.0/?language=en,image,,,,"A woven basket made of juncus rush and dyed raffia, creating two different shades of brown in the basket.",,http://www.portlandartmuseum.us/mwebcgi/mweb.exe?request=record;id=34766;type=101,Hunter,"Calapooia artist. Basket. ca. 1890/1920, Portland Art Museum, Portland, Oregon, http://www.portlandartmuseum.us/mwebcgi/mweb.exe?request=record;id=34766;type=101",basket_02_westernoregon_1890.jpg,Basket
basket_03_westernoregon_1900,Basket,Tillamook Artist,1900,A woven basket created by an unknown artist of the Tillamook people. The basket is made of conifer root and features no distinctive patterns or representations.,Baskets (containers),Oregon (state),,,Portland Art Museum,2012.25.19,Image;StillImage,image/jpeg,,No known copyright restrictions,https://rightsstatements.org/page/NKC/1.0/?language=en,image,,,,A woven basket made of conifer root. The basket features no distinctive patterns or representations and is of a light brown color.,,http://www.portlandartmuseum.us/mwebcgi/mweb.exe?request=record;id=33877;type=101,Hunter,"Tillamook artist. Basket. 1900, Portland Art Museum, Portland, Oregon, http://www.portlandartmuseum.us/mwebcgi/mweb.exe?request=record;id=33877;type=101",basket_03_westernoregon_1900.jpg,Basket
basket_04_oregon_1920,Basket ,Grand Ronde Artist,1920,"A woven basket with lid and handle created by an unknown artist from the Grand Ronde confederation of tribes, either in contemporary Oregon or Washington. The body of the basket has a climbing spiral pattern; the handle is composed of two overlapping braids. The base of the basket is round but the lid is square-sided, with a braided edge.",Baskets (containers),Oregon (state),,,Hallie Ford Museum of Art,2010.055.009,Image;StillImage,image/jpeg,,No known copyright restrictions ,https://rightsstatements.org/page/CNE/1.0/?language=en,image,,,,"A woven basket with lid and handle, the body of the basket has a climbing spiral pattern; the handle is composed of two overlapping braids. The base of the basket is round but the lid is square-sided, with a braided edge.",,https://willametteart.pastperfectonline.com/webobject/439145FA-3313-418A-AF13-921733871193,Anna,"Grande Rhonde artist. Basket. 1920, Hallie Ford Museum of Art, Salem, Oregon, https://willametteart.pastperfectonline.com/webobject/439145FA-3313-418A-AF13-921733871193",basket_04_oregon_1920.jpg,Basket
clothing_01_oregon_1870,Dress and belt with awl case,Wasco Artist,1870,"A two-hide Plateau dress created by an unknown artist of the Wapato people in the inland Northwest. The dress is decorated with beadwork, elk canines, glass beads, cowry shells, and fringe. The dress is worn with a matching belt and awl case.",Dresses (garments),Oregon (state); Washington (state),,,The Metropolitan Museum of Art,2019.456.1a,Image;StillImage,image/jpeg,,Public Domain,https://creativecommons.org/publicdomain/zero/1.0/,image,,,,"A two-hide Plateau dress is decorated with beadwork, elk canines, glass beads, cowry shells, and fringe. The dress is worn with a matching belt and awl case.",,https://www.metmuseum.org/art/collection/search/717542,David,"Wasco artist. Dress and belt with awl case. ca. 1870, The Metropolitan Museum of Art, New York City, New York, https://www.metmuseum.org/art/collection/search/717542",clothing_01_oregon_1870.jpg,Clothing
sculpture_01_sauvieisland_1830,Owl Sculpture,Wapato People,1830,A sculpture of an owl made of rock. Created by an unknown Wapato artist from Suvie Island.,Rock Carvings,Sauvie Island (island),,,Oregon Historical Society Museum,,Image;StillImage,image/jpeg,,Public Domain,https://creativecommons.org/publicdomain/zero/1.0/,image,,,,A spherical rock sculpture depicts the head of an owl.,,https://www.oregonencyclopedia.org/articles/native_american_art_on_sauvie_island/,Quinn,"Wapato People. Owl sculpture. 1830, Oregon Historical Society Museum, Portland, Oregon, https://www.oregonencyclopedia.org/articles/native_american_art_on_sauvie_island/",sculpture_01_sauvieisland_1830.jpg,Sculpture
sculpture_02_sauvieisland_1830,Rock Carvings ,Wapato People,1830,A photo of rock carvings from wapato people on sauvie island.,Rock Carvings,Sauvie Island (island),,,Oregon Historical Society Museum,,Image;StillImage,image/jpeg,,Public Domain,https://creativecommons.org/publicdomain/zero/1.0/,image,,,,A black-and-white photo that shows various rock carvings. The carvings are laid out on the steps of a house in 3 rows.,,https://www.oregonencyclopedia.org/articles/native_american_art_on_sauvie_island/,Quinn,"Wapato People. Rock Carvings. 1830, Oregon Historical Society Museum, Portland, Oregon, https://www.oregonencyclopedia.org/articles/native_american_art_on_sauvie_island/",sculpture_02_sauvieisland_1830.jpg,Sculpture
sculpture_03_unknown_1200,Pendant with figure,Unknown,1200,"A sculpture made of bone created by an unknown artist in the ancestral Columbia River, either in contemporary Oregon or Washington. The sculpture depicts a figure wearing an intricate headdress and skirt.",Ivories (Sculptures),Oregon (state); Washington (state),,,The Metropolitan Museum of Art,2021.434.4,Image;StillImage,image/jpeg,,Public domain,https://creativecommons.org/publicdomain/zero/1.0/,image,,,,A sculpture made of bone depicts a figure wearing an intricate headdress and skirt.,,https://www.metmuseum.org/art/collection/search/717580,David,"Ancestral Columbia River Native American. Pendant with figure. 3rd-13th century, The Metropolitan Museum of Art, New York City, New York, https://www.metmuseum.org/art/collection/search/717580",sculpture_03_unknown_1200.jpg,Sculpture
sculpture_04_oregonwashington_1700,Figure,Columbia River Artist,1700,"A bone figure from an unknown artist of the Columbia River region of either Oregon or Washington, dating back to the 18th century. This small sculpture, carved from bone, exemplifies the artistic traditions and materials used by local Indigenous cultures.",Ivories (Sculptures),Oregon (state); Washington (state),,,The Metropolitan Museum of Art,1978.412.283,Image;StillImage,image/jpeg,,Public domain,https://creativecommons.org/publicdomain/zero/1.0/,image,,,,"A small sculpture, carved from bone. The sculpture depicts an abstract representation of a figure. It exemplifies the artistic traditions and materials used by local Indigenous cultures.",,https://www.metmuseum.org/art/collection/search/310727,David,"Columbia River Native American. Bone figure. 18th century, The Metropolitan Museum of Art, New York City, New York, https://www.metmuseum.org/art/collection/search/310727",sculpture_04_oregonwashington_1700.jpg,Sculpture
sculpture_05_oregonwashington_1850,Ladle,Chinook Artist,1850,"An elaborate wooden ladle created by an unknown Chinook artist, used in ceremonial feasts. The ladle features an oval bowl, finely carved rim, and a flat handle adorned with two guardian birds, reflecting the Lower Columbia River style.",Wood Carvings,Oregon (state); Washington (state),,,The Metropolitan Museum of Art,2019.456.10,Image;StillImage,image/jpeg,,Public domain,https://creativecommons.org/publicdomain/zero/1.0/,image,,,,"An elaborate wooden ladle. The ladle features an oval bowl, finely carved rim, and a flat handle adorned with two guardian birds, reflecting the Lower Columbia River style.",,https://www.metmuseum.org/art/collection/search/751538,David,"Chinook Native American. Ladle. ca. 1850, The Metropolitan Museum of Art, New York City, New York, https://www.metmuseum.org/art/collection/search/751538",sculpture_05_oregonwashington_1850.jpg,Sculpture
drawing_01_oregon_1855,Chief Kamiakin,Gustavus Sohon,1855,A sketch depicting Cheif Kamiakin drawn by Gustavus Sohon.,Sketches,Oregon (state),,,Oregon Historical Society Research Library,,Image;StillImage,image/jpeg,,No known copyright restrictions,https://rightsstatements.org/page/NKC/1.0/?language=en,image,,,,A sketch depicting Cheif Kamiakin.,,https://www.oregonencyclopedia.org/articles/native_american_treaties_eastern_oregon/,Quinn,"Gustavus Sohon. Chief Kamiakin. 1855, Oregon Historical Society Research Library, Portland, Oregon, https://www.oregonencyclopedia.org/articles/indian_boarding_school/",drawing_01_oregon_1855.jpg,Drawing
photo_01_oregon_1937,Women Weaving on Looms,Unknown,1937,"A photo of women weaving at Chemawa Indian School in Salem, Oregon. The photographer that took the photo is unknown.",Photographs,Oregon (state),,,Oregon Historical Society Research Library,,Image;StillImage,image/jpeg,,No known copyright restrictions,https://rightsstatements.org/page/NKC/1.0/?language=en,image,,,,"A photo of women weaving at Chemawa Indian School in Salem, Oregon.",,https://www.oregonencyclopedia.org/articles/indian_boarding_school/,Quinn,"Unknown. Women Weaving on Looms. 1937, Oregon Historical Society Research Library, Portland, Oregon, https://www.oregonencyclopedia.org/articles/indian_boarding_school/",photo_01_oregon_1937.jpg,Photo
clothing_04_southernoregon_1850,Beaded Harness,Southern Oregon Coast Artist,1850,"A beaded harness used to attach animals to vehicles, created by an unknown artist from the Southern Oregon Coast. Features alternating geometric designs down each segment of the harness.",Animal Harnesses,Oregon (state),,,Portland Museum of Art,2005.73.21,Image;StillImage,image/jpeg,,No known copyright restrictions,https://rightsstatements.org/page/NKC/1.0/?language=en,image,,,,A beaded harness used to attach animals to vehicles. Features alternating geometric designs down each segment of the harness.,,http://www.portlandartmuseum.us/mwebcgi/mweb.exe?request=record;id=33093;type=101,Hunter,"Southern Oregon Coast artist. Beaded Harness. ca. 1850, Portland Museum of Art, Portland, Oregon, http://www.portlandartmuseum.us/mwebcgi/mweb.exe?request=record;id=33093;type=101",clothing_04_southernoregon_1850.jpg,Clothing
basket_05_oregon_1900,Basket with lid,Unknown,1900,"A small, tightly twined basket with lid. The basket has bold geometric pattern on sides and top in black and natural colored fiber; the interior is lined so the exterior weave is not visible on the inside of the basket.",Baskets (containers),Oregon (state),,,Hallie Ford Museum of Art,2013.032.002,Image;StillImage,image/jpeg,,No known copyright restrictions ,https://rightsstatements.org/page/CNE/1.0/?language=en,image,,,,"A small, tightly twined basket with lid. The basket has bold geometric pattern on sides and top in black and natural colored fiber; the interior is lined so the exterior weave is not visible on the inside of the basket.",,https://willametteart.pastperfectonline.com/webobject/4BBA6EDE-EC2E-4A13-88BE-157475801688,Conner,"Unknown. Basket. 1900, Hallie Ford Museum of Art, Salem, Oregon, https://willametteart.pastperfectonline.com/webobject/4BBA6EDE-EC2E-4A13-88BE-157475801688",basket_05_oregon_1900.jpg,Basket
basket_06 _oregon_1900,Hamper and lid,Unknown,1900,"A basket of willow sticks created by an unknown Native American artist of contemporary Oregon, woven into a tall egg-like shape. The matching woven lid is attached by a leather thong.",Baskets (containers),Oregon (state),,,Hallie Ford Museum of Art,2008.06,Image;StillImage,image/jpeg,,No known copyright restrictions ,https://rightsstatements.org/page/CNE/1.0/?language=en,image,,,,A basket of willow sticks woven into a tall egg-like shape. The matching woven lid is attached by a leather thong.,,https://willametteart.pastperfectonline.com/webobject/FBB55AC5-65FB-4EB6-9F83-993955088741,Conner,"Unknown. Basket. Ca. 1900, Hallie Ford Museum of Art, Salem, Oregon, https://willametteart.pastperfectonline.com/webobject/FBB55AC5-65FB-4EB6-9F83-993955088741",basket_06_oregon_1900.jpg,Basket
basket_07_oregon_1900,Clatsop Basket,Unknown,1930,"A large, open basket, created by an unknown Native American artist of contemporary Oregon. The basket is loosely woven with a decorative band below the rim, light natural brown with a few pairs of dark-dyed fibers.",Baskets (containers),Oregon (state),,,Hallie Ford Museum of Art,2012.010.001,Image;StillImage,image/jpeg,,No known copyright restrictions ,https://rightsstatements.org/page/CNE/1.0/?language=en,image,,,,"A large, open basket. The basket is loosely woven with a decorative band below the rim, light natural brown with a few pairs of dark-dyed fibers.",,https://willametteart.pastperfectonline.com/webobject/243D9DF6-0D7D-4959-9378-057738755841,Conner,"Unknown. Basket. Ca. 1930, Hallie Ford Museum of Art, Salem, Oregon, https://willametteart.pastperfectonline.com/webobject/243D9DF6-0D7D-4959-9378-057738755841",basket_07_oregon_1900.jpg,Basket
basket_08_oregon_1900,Acorn mush bowl,Unknown,1900,A rounded basket created by an unknown Native American artist of contemporary Oregon. The basket is constructed mostly of a red-brown fibrous plant with an inch-wide band of decoration in yellow near the rim.,Baskets (containers),Oregon (state),,,Hallie Ford Museum of Art,2001.059.004,Image;StillImage,image/jpeg,,No known copyright restrictions ,https://rightsstatements.org/page/CNE/1.0/?language=en,image,,,,A rounded basket. The basket is constructed mostly of a red-brown fibrous plant with an inch-wide band of decoration in yellow near the rim.,,https://willametteart.pastperfectonline.com/webobject/8D5F6007-0395-4C28-891F-309799605939,Conner,"Unknown. Basket. Ca. 1900, Hallie Ford Museum of Art, Salem, Oregon, https://willametteart.pastperfectonline.com/webobject/8D5F6007-0395-4C28-891F-309799605939",basket_08_oregon_1900.jpg,Basket
basket_09_oregon_1900,Basket,Unknown,1900,"A shallow, spiral woven twined basket created by an unknown Native American artist of contemporary Oregon. The basket features no distinctive designs.",Baskets (containers),Oregon (state); California (state),,,Hallie Ford Museum of Art,2008.015.002,Image;StillImage,image/jpeg,,No known copyright restrictions ,https://rightsstatements.org/page/CNE/1.0/?language=en,image,,,,"A shallow, spiral woven twined basket. The basket features no distinctive designs.",,https://willametteart.pastperfectonline.com/webobject/17188AE0-6D14-4B2E-8319-426553005430,Conner,"Unknown. Basket. Pre-1900, Hallie Ford Museum of Art, Salem, Oregon, https://willametteart.pastperfectonline.com/webobject/17188AE0-6D14-4B2E-8319-426553005430",basket_09_oregon_1900.jpg,Basket
bag_04_oregon_1940,Berry Bag,Umatilla Artist,1940,"A bag made out of commercial dyes, buckskin, and cotton by an unknown Umatilla artist. The bag is primarily made of a light purple cotton with one side featuring a portrait of a Native American with a black and light purple checkered pattern surrounding the portrait.",Bags (generic containers),Oregon (state),,,Portland Art Museum,2012.92.21,Image;StillImage,image/jpeg,,No known copyright restrictions,https://rightsstatements.org/page/NKC/1.0/?language=en,image,,,,"A bag made out of commercial dyes, buckskin, and cotton. The bag is primarily made of a light purple cotton with one side featuring a portrait of a Native American with a black and light purple checkered pattern surrounding the portrait.",,http://portlandartmuseum.us/mwebcgi/mweb.exe?request=record;id=37678;type=101,Anna,"Umatilla artist. Berry Bag. 1920/1940, Portland Museum of Art, Portland, Oregon, http://portlandartmuseum.us/mwebcgi/mweb.exe?request=record;id=37678;type=101",bag_04_oregon_1940.jpg,Bag
clothing_02_oregonwashingtonidaho_1870,Bowcase and Quiver,Nez Perce Artist,1870,"A bowcase and quiver made by an unknown Nez Perce artist. The pieces are made of otter skin, leather, wool cloth, glass beads, ermine, and silk ribbon. Originating from Idaho, Oregon, or Washington, this set reflects skilled craftsmanship and the material culture of the Nez Perce people.",Quivers,Oregon (state); Washington (state); Idaho (state),,,The Metropolitan Museum of Art,1999.484.14,Image;StillImage,image/jpeg,,No known copyright restrictions,https://rightsstatements.org/page/NKC/1.0/?language=en,image,,,,"A bowcase and quiver made of otter skin, leather, wool cloth, glass beads, ermine, and silk ribbon. The set has colored beadwork in geometric patterns on some spots and otter fur in other spots.",,https://www.metmuseum.org/art/collection/search/318357,David,"Nez Perce artist. Bowcase and Quiver. ca. 1870, The Metropolitan Museum of Art, New York City, New York, https://www.metmuseum.org/art/collection/search/318357",clothing_02_oregonwashingtonidaho_1870.jpg,Clothing
clothing_03_southernoregon_1850,Apron,Southern Oregon Coast Artist,1850,"An apron made out of beargrass, leather, and glass beads made by an unknown Southern Oregon Coast artist. The band at the top features red and blue string and subtle geometric patterns.",Apron,Oregon (state),,,Portland Art Museum,2005.73.28,Image;StillImage,image/jpeg,,No known copyright restrictions,https://rightsstatements.org/page/NKC/1.0/?language=en,image,,,,"An apron made out of beargrass, leather, and glass beads. The band at the top features red and blue string and subtle geometric patterns.",,http://www.portlandartmuseum.us/mwebcgi/mweb.exe?request=record;id=33100;type=101,Anna,"Southern Oregon Coast artist. Apron. ca. 1850, Portland Art Museum, Portland, Oregon, http://www.portlandartmuseum.us/mwebcgi/mweb.exe?request=record;id=33100;type=101",clothing_03_southernoregon_1850.jpg,Clothing